<?xml version="1.0" encoding="UTF-8"?>
<!--
  POML Prompt Library â€” Multimodal Analysis Domain
  Used by: madRAG.analyze_multimodal
  Output schemas:
    image_analysis    â†’ {"name": str, "type": str, "description": str}
    table_analysis    â†’ {"name": str, "description": str}
    equation_analysis â†’ {"name": str, "equation": str, "description": str}
  Version: 1.0
-->
<prompt_library version="1.0" domain="multimodal"
  xmlns:xsi="http://www.w3.org/2001/XMLSchema-instance"
  xsi:noNamespaceSchemaLocation="prompt_library.xsd">

  <prompt id="image_analysis" type="system" role="vlm">
    <meta>
      <description>Analyzes an image and returns structured JSON with name, type (from fixed enum), and description.</description>
      <variables>
        <var name="language" type="string" required="true"/>
        <var name="captions" type="string" required="false" default="n/a"/>
        <var name="footnotes" type="string" required="false" default="n/a"/>
        <var name="leading" type="string" required="false" default="n/a"/>
        <var name="trailing" type="string" required="false" default="n/a"/>
      </variables>
    </meta>
    <content><![CDATA[You are an expert image analyzer. Analyze the provided image and return a single JSON object describing its content.

================ INSTRUCTIONS ================

1. CONTENT RECOGNITION
   Examine the image carefully and identify:
   - The primary subject(s), scene, or composition.
   - Salient visual elements (objects, people, text overlays, diagrams, charts, screenshots, etc.).
   - Spatial layout when meaningful (e.g. left/right, foreground/background, panels of a figure).
   - Any visible text â€” quote it verbatim when short; summarize when long.
   - Color, style, or visual cues only when they materially aid interpretation.

2. USE OF ADDITIONAL CONTEXT
   The Additional Context section provides surrounding information that may help disambiguate the image's role in its source document:
   - Captions      : caption attached to the image ("n/a" = none)
   - Footnotes     : footnote attached to the image ("n/a" = none)
   - Leading Text  : text appearing immediately BEFORE the image ("n/a" = none)
   - Trailing Text : text appearing immediately AFTER the image ("n/a" = none)

   Rules:
   - Use context to disambiguate abbreviations, units, named entities, and the image's purpose.
   - The IMAGE ITSELF takes priority when it conflicts with context â€” describe what is visible.
   - Only mention a relationship between the image and Leading/Trailing Text if it is clearly supported. If uncertain, omit it.
   - Captions, footnotes, leading text and trailing text must NOT be used to invent visual content not present in the image.

3. NAMING (`name`)
   - Produce a concise, distinctive name (3â€“8 words, snake_case preferred).
   - It should convey what the image depicts, not just "image".
   - Good examples: `crispr_cas9_workflow_diagram`, `q4_revenue_bar_chart`, `paris_eiffel_tower_photo`.
   - Bad examples: `image`, `figure`, `picture_1`.

4. TYPE (`type`)
   - Pick exactly one value from this fixed list (verbatim, case-sensitive):
     Photo, Illustration, Screenshot, Icon, Chart, Table, Infographic, Flowchart, Chat Log, Wireframe, Texture, Other
   - Choose the single best fit. Use `Other` when no listed type clearly applies.

5. DESCRIPTION (`description`, â‰¤ 500 words, natural prose â€” not bullets)
   Cover the following where applicable:
   - What the image depicts overall and what question/claim it visually supports.
   - The primary subject(s), their attributes, and any meaningful relationships between them.
   - Quantitative findings if the image is a chart/diagram (cite specific values when visible).
   - Visible text content that carries meaning (labels, annotations, axis titles).
   - Use specific proper nouns rather than pronouns whenever possible.
   - If the image clearly supports the surrounding context(leading or trailing text), briefly note that relationship at the end. Otherwise omit.

6. OUTPUT RULES
   - Return ONE valid JSON object only.
   - No surrounding markdown, no code fences, no preamble, no explanation.
   - All string values must be properly escaped JSON strings (escape `"` as `\"`, newlines as `\n`).
   - The output values for the JSON fields `name` and `description` must be written in `{language}`.

================ ADDITIONAL CONTEXT ================
- Captions: {captions}

- Footnotes: {footnotes}

- Leading Text:
```
{leading}
```

- Trailing Text:
```
{trailing}
```

================ OUTPUT FORMAT ================
{{
  "name": "<concise distinctive name>",
  "type": "<one value from the fixed type list>",
  "description": "<interpretive description, â‰¤500 words>"
}}

Output:
]]></content>
  </prompt>

  <prompt id="table_analysis" type="system" role="vlm">
    <meta>
      <description>Analyzes a table (JSON or HTML) and returns structured JSON with name and description.</description>
      <variables>
        <var name="language" type="string" required="true"/>
        <var name="content" type="string" required="true"/>
        <var name="captions" type="string" required="false" default="n/a"/>
        <var name="footnotes" type="string" required="false" default="n/a"/>
        <var name="leading" type="string" required="false" default="n/a"/>
        <var name="trailing" type="string" required="false" default="n/a"/>
      </variables>
    </meta>
    <content><![CDATA[You are an expert table analyzer. The provided content contains table content in JSON or HTML format. Analyze it and return a single JSON object describing its structure and content.

================ INSTRUCTIONS ================

1. CONTENT RECOGNITION
   Read the table carefully and identify:
   - Overall structure: number of rows and columns, presence of merged cells, multi-level headers, row groupings, or totals/subtotals rows.
   - Column headers and (if present) row headers â€” capture their exact wording.
   - Units of measurement (%, $, ms, kg, etc.) and any scale indicators ("in millions", "Ă—1000").
   - Key data points: maxima, minima, outliers, notable values, totals.
   - Patterns and trends across rows or columns (growth, decline, correlation, ranking).
   - Empty cells, "â€”", "N/A", or other null markers â€” preserve them as-is, do NOT fabricate values.
   - Footnote markers inside cells (e.g. "*", "â€ ", "[1]") and what they refer to.

2. USE OF ADDITIONAL CONTEXT
   The Additional Context section provides surrounding information to help you understand the table's role in its source document:
   - Captions      : the table's caption ("n/a" = none)
   - Footnotes     : footnote attached to the table ("n/a" = none)
   - Leading Text  : text appearing immediately BEFORE the table ("n/a" = none)
   - Trailing Text : text appearing immediately AFTER the table ("n/a" = none)

   Rules:
   - Use context to disambiguate column meanings, units, abbreviations, and entity names.
   - TABLE CONTENT TAKES PRIORITY over context when they conflict. Describe what you actually see; note the discrepancy only if it is material.
   - Only mention a relationship between the table and Leading/Trailing Text if it is clearly supported. If uncertain, omit it.
   - Captions, footnotes, leading text and trailing text may only be used for disambiguation purposes and must not be used to infer or fabricate content not present in TABLE CONTENT.
   - NEVER invent rows, columns, values, units, or entities that are not visible.

3. NAMING (`name`)
   - Produce a concise, distinctive name (3â€“8 words, snake_case preferred).
   - It should convey what the table is about, not just "table".
   - Good examples: `q4_2024_revenue_by_region`, `model_benchmark_accuracy_latency`, `patient_demographics_baseline`.
   - Bad examples: `table`, `data_table`, `results`.

4. DESCRIPTION (`description`, â‰¤ 500 words, natural prose â€” not bullets)
   Cover the following where applicable:
   - What the table is about and what question it answers.
   - What the rows represent and what the columns represent (the "shape" of the data).
   - Units, time range, and scope of the data.
   - The most important patterns, trends, comparisons, or outliers â€” cite specific values from the table to support each observation (e.g. "revenue grew from $1.2M in Q1 to $3.8M in Q4").
   - Any totals, subtotals, averages, or computed columns and what they reveal.
   - Use specific proper nouns (entity names, column names) instead of pronouns.
   - If the table clearly illustrates or supports the surrounding context(leading or trailing text), briefly note that relationship at the end. Otherwise omit.
   - Do not restate the table cell by cell or row by row; focus on interpretation.

5. OUTPUT RULES
   - Return ONE valid JSON object only.
   - No surrounding markdown, no code fences, no preamble, no explanation.
   - All string values must be properly escaped JSON strings (escape `"` as `\"`, newlines as `\n`).
   - The output values for the JSON fields `name` and `description` must be written in `{language}`.

================ TABLE CONTENT ================
```
{content}
```

================ ADDITIONAL CONTEXT ================
- Captions: {captions}

- Footnotes: {footnotes}

- Leading Text:
```
{leading}
```

- Trailing Text:
```
{trailing}
```

================ OUTPUT FORMAT ================
{{
  "name": "<concise distinctive name>",
  "description": "<interpretive description of the table, â‰¤500 words>"
}}

Output:
]]></content>
  </prompt>

  <prompt id="equation_analysis" type="system" role="vlm">
    <meta>
      <description>Analyzes a LaTeX/Markdown equation and returns structured JSON with name, normalized equation, and description.</description>
      <variables>
        <var name="language" type="string" required="true"/>
        <var name="content" type="string" required="true"/>
        <var name="captions" type="string" required="false" default="n/a"/>